<?xml version="1.0"?>
<!DOCTYPE OpenCReport SYSTEM "opencreport.dtd">
<OpenCReport>
	<Part>
		<pr>
			<pd>
				<Report>
				</Report>
			</pd>
		</pr>
		<pr>
			<pd>
				<Report>
				</Report>
				<Report>
				</Report>
			</pd>
		</pr>
		<pr>
			<pd>
				<Report>
				</Report>
			</pd>
			<pd>
				<Report>
				</Report>
			</pd>
		</pr>
	</Part>
	<Part>
		<pr>
			<pd>
				<Report>
				</Report>
			</pd>
			<pd>
				<Report>
				</Report>
			</pd>
		</pr>
		<pr>
			<pd>
				<Report>
				</Report>
			</pd>
		</pr>
		<pr>
			<pd>
				<Report>
				</Report>
				<Report>
				</Report>
			</pd>
		</pr>
	</Part>
	<Report>
	</Report>
	<Report>
	</Report>
</OpenCReport>
