<?xml version="1.0"?>
<!DOCTYPE OpenCReport SYSTEM "opencreport.dtd">
<OpenCReport>
	<Datasources>
		<Datasource name="myarray" type="'array'" />
	</Datasources>
	<Queries>
		<Query name="a" datasource="myarray" value="'array'" coltypes="'coltypes'" rows="0" cols="5" />
	</Queries>
	<Report fontSize="12">
		<NoData>
			<Output>
				<HorizontalLine size="1" color="'Black'" />
				<Line>
					<field value="'OpenCReports has links now!'" link="'https://github.com/zboszor/OpenCReports'" />
				</Line>
				<HorizontalLine size="1" color="'Black'" />
				<Line>
					<literal link="'https://github.com/zboszor/OpenCReports'" >OpenCReports has links now!</literal>
				</Line>
				<HorizontalLine size="1" color="'Black'" />
			</Output>
		</NoData>
	</Report>
</OpenCReport>
