<?xml version="1.0"?>
<!DOCTYPE OpenCReport SYSTEM "opencreport.dtd">
<OpenCReport>
	<Datasources>
		<Datasource name="myarray" type="'array'" />
	</Datasources>
	<Queries>
		<Query name="a" datasource="myarray" value="'array'" coltypes="'coltypes'" rows="120" cols="6" />
	</Queries>
	<Part fontSize="10" suppressPageHeaderFirstPage="yes">
		<pr>
			<pd>
				<Report query="nonexisting">
					<NoData>
						<Output>
							<HorizontalLine size="400" color="'yellow'" />
						</Output>
					</NoData>
				</Report>
			</pd>
		</pr>
		<pr>
			<pd>
				<Report query="nonexisting">
					<NoData>
						<Output>
							<HorizontalLine size="1" color="'red'" />
						</Output>
					</NoData>
				</Report>
			</pd>
		</pr>
		<pr>
			<pd detail_columns="2" column_pad="0.2" height="25" border_width="2" border_color="'bobkratz'">
				<Report fontSize="12" paperType="A4" orientation="landscape">
					<NoData>
						<Output>
							<HorizontalLine size="1" color="'Black'" />
							<Line>
								<field value="'There'" width="6" color="'Red'" bgcolor="'Blue'" bold="yes" />
								<literal width="3" align="'right'" color="'White'" bgcolor="'Black'" >is</literal>
								<field value="'no'" width="3" align="'center'" color="'Lime'" bgcolor="'Teal'" italic="yes" />
								<literal width="5" color="'Aqua'" bgcolor="'Silver'" >data</literal>
								<field value="'here.'" width="5" color="'Fuchsia'" bgcolor="'Green'"  />
							</Line>
							<HorizontalLine size="1" color="'Black'" />
						</Output>
					</NoData>

					<PageHeader>
						<Output>
							<HorizontalLine size="2" color="'Black'"/>
							<Line fontSize="14">
								<field value="printf('Page header: %d / %d', r.pageno, r.totpages)" align="right" />
							</Line>
							<HorizontalLine size="2" color="'Black'"/>
							<HorizontalLine size="4" color="'white'"/>
						</Output>
					</PageHeader>

					<PageFooter>
						<Output>
							<HorizontalLine size="2" color="'Black'"/>
							<Line fontSize="14">
								<field value="printf('Page footer: %d / %d', r.pageno, r.totpages)" align="right" />
							</Line>
							<HorizontalLine size="2" color="'Black'"/>
						</Output>
					</PageFooter>

					<Detail>
						<FieldHeaders>
							<Output>
								<HorizontalLine size="1" bgcolor="'black'"/>
								<Line bgcolor="'0xe5e5e5'">
									<literal width="3" col="1">ID</literal>
									<literal width="1"/>
									<literal width="20" col="2">Name</literal>
									<literal width="1"/>
									<literal width="6" col="3">lineno</literal>
									<literal width="1"/>
									<literal width="6" col="4">rownum</literal>
									<literal width="1"/>
									<literal width="9" col="5">detailcnt</literal>
								</Line>
								<HorizontalLine size="1" bgcolor="'black'"/>
								<HorizontalLine size="4" bgcolor="'white'"/>
							</Output>
						</FieldHeaders>

						<FieldDetails>
							<Output>
								<Line bgcolor="iif(r.detailcnt%2,'0xe5e5e5','white')">
									<field value="id" width="3" align="right" col="1"/>
									<literal width="1"/>
									<field value="name" width="20" align="left" col="2"/>
									<literal width="1"/>
									<field value="r.lineno" width="6" align="'right'" col="3"/>
									<literal width="1"/>
									<field value="rownum()" width="6" align="'right'" col="4"/>
									<literal width="1"/>
									<field value="r.detailcnt" width="9" align="'right'" col="5"/>
								</Line>
							</Output>
						</FieldDetails>
					</Detail>
				</Report>
			</pd>
		</pr>
		<pr>
			<pd>
				<Report query="nonexisting">
					<NoData>
						<Output>
							<HorizontalLine size="1" color="'red'" />
						</Output>
					</NoData>
				</Report>
			</pd>
		</pr>
	</Part>
</OpenCReport>
