<?xml version="1.0"?>
<!DOCTYPE OpenCReport SYSTEM "opencreport.dtd">
<OpenCReport size_unit="points">
	<Datasources>
		<Datasource name="myarray" type="'array'" />
	</Datasources>
	<Queries>
		<Query name="a" datasource="myarray" value="'array'" coltypes="'coltypes'" rows="9" cols="5" />
	</Queries>
	<Part fontName="Petaluma Script">
		<pr>
			<pd detail_columns="2" column_pad="2" border_width="2" border_color="'bobkratz'">
				<Report fontSize="12" paperType="A4" orientation="landscape">
					<PageHeader>
						<Output>
							<HorizontalLine size="2" color="'Black'"/>
							<Line fontSize="14">
								<field value="printf('Page header: %d / %d', r.pageno, r.totpages)" align="right" />
							</Line>
							<HorizontalLine size="2" color="'Black'"/>
						</Output>
					</PageHeader>

					<PageFooter>
						<Output>
							<HorizontalLine size="2" color="'Black'"/>
							<Line fontSize="14">
								<field value="printf('Page footer: %d / %d', r.pageno, r.totpages)" align="right" />
							</Line>
							<HorizontalLine size="2" color="'Black'"/>
						</Output>
					</PageFooter>

					<Detail>
						<FieldHeaders>
							<Output>
								<HorizontalLine size="1" bgcolor="'black'"/>
								<Line bgcolor="'0xe5e5e5'">
									<literal width="30" col="1">ID</literal>
									<literal width="5"/>
									<literal width="160" col="2">Name</literal>
									<literal width="5"/>
									<literal width="75" col="3" align="'center'">Property</literal>
									<literal width="5"/>
									<literal width="60" col="4">Age</literal>
									<literal width="5"/>
									<literal width="60" col="5" align="'center'">Adult</literal>
								</Line>
								<HorizontalLine size="1" bgcolor="'black'"/>
							</Output>
						</FieldHeaders>

						<FieldDetails>
							<Output>
								<Line bgcolor="iif(r.detailcnt%2,'0xe5e5e5','white')">
									<field value="id" width="30" align="right" col="1"/>
									<literal width="5"/>
									<field value="name" width="160" align="left" col="2" memo="yes" memo_wrap_chars="yes" />
									<literal width="5"/>
									<field value="property" width="75" align="'center'" col="3" memo="yes"/>
									<literal width="5"/>
									<field value="age" width="60" format="'%.2d'" align="'right'" col="4"/>
									<literal width="5"/>
									<field value="adult ? 'yes' : 'no'" width="60" align="'center'" col="5"/>
								</Line>
							</Output>
						</FieldDetails>
					</Detail>
				</Report>
			</pd>
		</pr>
	</Part>
</OpenCReport>
