<?xml version="1.0"?>
<!DOCTYPE OpenCReport SYSTEM "opencreport.dtd">
<OpenCReport>
	<Datasources>
		<Datasource name="myarray" type="'array'" />
	</Datasources>
	<Queries>
		<Query name="a" datasource="myarray" value="'array'" coltypes="'coltypes'" rows="5" cols="5" />
		<Query name="b" datasource="myarray" value="'array2'" coltypes="'coltypes'" rows="4" cols="5" />
	</Queries>
	<Part iterations="3">
		<pr>
			<pd>
				<load name="layout_pdf_xml17_loaded_part.xml" query="a" />
			</pd>
			<pd width="2" />
			<pd>
				<load name="layout_pdf_xml17_loaded_part.xml" query="b" />
			</pd>
		</pr>
	</Part>
</OpenCReport>
