<?xml version="1.0"?>
<!DOCTYPE OpenCReport SYSTEM "opencreport.dtd">
<OpenCReport>
	<Datasources>
		<Datasource name="myarray" type="'array'" />
	</Datasources>
	<Queries>
		<Query name="a" datasource="myarray" value="'array'" coltypes="'coltypes'" rows="5" cols="5" />
	</Queries>
	<Report fontSize="12">
		<NoData>
			<Output>
				<HorizontalLine size="1" color="'Black'" />
				<Line>
					<field value="'There'" width="6" color="'Red'" bgcolor="'Blue'" bold="yes" />
					<literal width="3" align="'right'" color="'White'" bgcolor="'Black'" >is</literal>
					<field value="'no'" width="3" align="'center'" color="'Lime'" bgcolor="'Teal'" italic="yes" />
					<literal width="5" color="'Aqua'" bgcolor="'Silver'" >data</literal>
					<field value="'here.'" width="5" color="'Fuchsia'" bgcolor="'Green'"  />
				</Line>
				<HorizontalLine size="1" color="'Black'" />
			</Output>
		</NoData>

		<ReportHeader>
			<Output>
				<HorizontalLine size="1" color="'Red'" />
				<Line fontSize="14">
					<literal>Flintstones report 1 header</literal>
				</Line>
				<HorizontalLine size="4" bgcolor="'white'"/>
				<HorizontalLine size="2" bgcolor="'black'"/>
				<HorizontalLine size="4" bgcolor="'white'"/>
			</Output>
		</ReportHeader>

		<ReportFooter>
			<Output>
				<HorizontalLine size="1" color="'Red'" />
				<Line fontSize="14">
					<literal>Flintstones report 1 footer</literal>
				</Line>
				<HorizontalLine size="4" bgcolor="'white'"/>
				<HorizontalLine size="2" bgcolor="'black'"/>
				<HorizontalLine size="4" bgcolor="'white'"/>
			</Output>
		</ReportFooter>

		<Detail>
			<FieldHeaders>
				<Output>
					<HorizontalLine size="1" bgcolor="'black'"/>
					<Line bgcolor="'0xe5e5e5'">
						<literal width="4" col="1">ID</literal>
						<literal width="1"/>
						<literal width="20" col="2">Name</literal>
						<literal width="1"/>
						<literal width="10" col="3">Property</literal>
						<literal width="1"/>
						<literal width="5" col="4">Age</literal>
						<literal width="1"/>
						<literal width="5" col="5">Adult</literal>
					</Line>
					<HorizontalLine size="1" bgcolor="'black'"/>
					<HorizontalLine size="4" bgcolor="'white'"/>
				</Output>
			</FieldHeaders>

			<FieldDetails>
				<Output>
					<Line>
						<field value="id" width="4" align="right" col="1"/>
						<literal width="1"/>
						<field value="name" width="20" align="left" col="2"/>
						<literal width="1"/>
						<field value="property" width="10" align="'left'" col="3"/>
						<literal width="1"/>
						<field value="age" width="5" format="'%.2d'" align="'right'" col="4"/>
						<literal width="1"/>
						<field value="adult ? 'yes' : 'no'" width="5" align="'center'" col="5"/>
					</Line>
				</Output>
			</FieldDetails>
		</Detail>

	</Report>
</OpenCReport>
